{
  "plug": "0",
  "id": "zone.work.notes",
  "name": "Notes",
  "version": "0.1.0",
  "kind": "tool",
  "entry": "index.html",
  "views": [
    "panel"
  ],
  "hosts": [
    "any"
  ],
  "permissions": {
    "storage": "512KB",
    "ui": "panel"
  },
  "author_key": "ed25519:0000000000000000000000000000000000000000000000000000000000000000",
  "description": "Quick notes that save privately on this device. Search, pin, and nothing ever leaves the plug."
}
